codigo,nombre,afecto_iva,categoria
351020,TRANSMISIÓN DE ENERGÍA ELÉCTRICA,SI,"SUMINISTRO DE ELECTRICIDAD, GAS, VAPOR Y AIRE ACONDICIONADO"
351030,DISTRIBUCIÓN DE ENERGÍA ELÉCTRICA,SI,"SUMINISTRO DE ELECTRICIDAD, GAS, VAPOR Y AIRE ACONDICIONADO"
352010,REGASIFICACIÓN DE GAS NATURAL LICUADO (GNL),SI,"SUMINISTRO DE ELECTRICIDAD, GAS, VAPOR Y AIRE ACONDICIONADO"
352020,"FABRICACIÓN DE GAS; DISTRIBUCIÓN DE COMBUSTIBLES GASEOSOS POR TUBERÍA, EXCEPTO REGASIFICACIÓN DE GNL",SI,"SUMINISTRO DE ELECTRICIDAD, GAS, VAPOR Y AIRE ACONDICIONADO"
353001,SUMINISTRO DE VAPOR Y DE AIRE ACONDICIONADO,SI,"SUMINISTRO DE ELECTRICIDAD, GAS, VAPOR Y AIRE ACONDICIONADO"
353002,ELABORACIÓN DE HIELO (EXCEPTO FABRICACIÓN DE HIELO SECO),SI,"SUMINISTRO DE ELECTRICIDAD, GAS, VAPOR Y AIRE ACONDICIONADO"
360000,"CAPTACIÓN, TRATAMIENTO Y DISTRIBUCIÓN DE AGUA",SI,"SUMINISTRO DE AGUA; EVACUACIÓN DE AGUAS RESIDUALES, GESTIÓN DE DESECHOS Y DESCONTAMINACIÓN"
370000,EVACUACIÓN Y TRATAMIENTO DE AGUAS SERVIDAS,SI,"SUMINISTRO DE AGUA; EVACUACIÓN DE AGUAS RESIDUALES, GESTIÓN DE DESECHOS Y DESCONTAMINACIÓN"
381100,RECOGIDA DE DESECHOS NO PELIGROSOS,NO,"SUMINISTRO DE AGUA; EVACUACIÓN DE AGUAS RESIDUALES, GESTIÓN DE DESECHOS Y DESCONTAMINACIÓN"
381200,RECOGIDA DE DESECHOS PELIGROSOS,SI,"SUMINISTRO DE AGUA; EVACUACIÓN DE AGUAS RESIDUALES, GESTIÓN DE DESECHOS Y DESCONTAMINACIÓN"
382100,TRATAMIENTO Y ELIMINACIÓN DE DESECHOS NO PELIGROSOS,NO,"SUMINISTRO DE AGUA; EVACUACIÓN DE AGUAS RESIDUALES, GESTIÓN DE DESECHOS Y DESCONTAMINACIÓN"
382200,TRATAMIENTO Y ELIMINACIÓN DE DESECHOS PELIGROSOS,SI,"SUMINISTRO DE AGUA; EVACUACIÓN DE AGUAS RESIDUALES, GESTIÓN DE DESECHOS Y DESCONTAMINACIÓN"
383001,RECUPERACIÓN Y RECICLAMIENTO DE DESPERDICIOS Y DESECHOS METÁLICOS,SI,"SUMINISTRO DE AGUA; EVACUACIÓN DE AGUAS RESIDUALES, GESTIÓN DE DESECHOS Y DESCONTAMINACIÓN"
383002,RECUPERACIÓN Y RECICLAMIENTO DE PAPEL,SI,"SUMINISTRO DE AGUA; EVACUACIÓN DE AGUAS RESIDUALES, GESTIÓN DE DESECHOS Y DESCONTAMINACIÓN"
383003,RECUPERACIÓN Y RECICLAMIENTO DE VIDRIO,SI,"SUMINISTRO DE AGUA; EVACUACIÓN DE AGUAS RESIDUALES, GESTIÓN DE DESECHOS Y DESCONTAMINACIÓN"
383009,RECUPERACIÓN Y RECICLAMIENTO DE OTROS DESPERDICIOS Y DESECHOS N.C.P.,SI,"SUMINISTRO DE AGUA; EVACUACIÓN DE AGUAS RESIDUALES, GESTIÓN DE DESECHOS Y DESCONTAMINACIÓN"
390000,ACTIVIDADES DE DESCONTAMINACIÓN Y OTROS SERVICIOS DE GESTIÓN DE DESECHOS,SI,"SUMINISTRO DE AGUA; EVACUACIÓN DE AGUAS RESIDUALES, GESTIÓN DE DESECHOS Y DESCONTAMINACIÓN"
410010,CONSTRUCCIÓN DE EDIFICIOS PARA USO RESIDENCIAL,SI,CONSTRUCCIÓN
410020,CONSTRUCCIÓN DE EDIFICIOS PARA USO NO RESIDENCIAL,NO,CONSTRUCCIÓN
421000,CONSTRUCCIÓN DE CARRETERAS Y LÍNEAS DE FERROCARRIL,SI,CONSTRUCCIÓN
422000,CONSTRUCCIÓN DE PROYECTOS DE SERVICIO PÚBLICO,SI,CONSTRUCCIÓN
429000,CONSTRUCCIÓN DE OTRAS OBRAS DE INGENIERÍA CIVIL,SI,CONSTRUCCIÓN
431100,DEMOLICIÓN,SI,CONSTRUCCIÓN
431200,PREPARACIÓN DEL TERRENO,SI,CONSTRUCCIÓN
432100,INSTALACIONES ELÉCTRICAS,SI,CONSTRUCCIÓN
432200,"INSTALACIONES DE GASFITERÍA, CALEFACCIÓN Y AIRE ACONDICIONADO",SI,CONSTRUCCIÓN
432900,OTRAS INSTALACIONES PARA OBRAS DE CONSTRUCCIÓN,SI,CONSTRUCCIÓN
433000,TERMINACIÓN Y ACABADO DE EDIFICIOS,SI,CONSTRUCCIÓN
439000,OTRAS ACTIVIDADES ESPECIALIZADAS DE CONSTRUCCIÓN,SI,CONSTRUCCIÓN
451001,VENTA AL POR MAYOR DE VEHÍCULOS AUTOMOTORES,SI,COMERCIO AL POR MAYOR Y AL POR MENOR; REPARACIÓN DE VEHICULOS AUTOMOTORES Y MOTOCICLETAS
451002,VENTA AL POR MENOR DE VEHÍCULOS AUTOMOTORES NUEVOS O USADOS (INCLUYE COMPRAVENTA),SI,COMERCIO AL POR MAYOR Y AL POR MENOR; REPARACIÓN DE VEHICULOS AUTOMOTORES Y MOTOCICLETAS
452001,SERVICIO DE LAVADO DE VEHÍCULOS AUTOMOTORES,SI,COMERCIO AL POR MAYOR Y AL POR MENOR; REPARACIÓN DE VEHICULOS AUTOMOTORES Y MOTOCICLETAS
452002,MANTENIMIENTO Y REPARACIÓN DE VEHÍCULOS AUTOMOTORES,SI,COMERCIO AL POR MAYOR Y AL POR MENOR; REPARACIÓN DE VEHICULOS AUTOMOTORES Y MOTOCICLETAS
453000,"VENTA DE PARTES, PIEZAS Y ACCESORIOS PARA VEHÍCULOS AUTOMOTORES",SI,COMERCIO AL POR MAYOR Y AL POR MENOR; REPARACIÓN DE VEHICULOS AUTOMOTORES Y MOTOCICLETAS
454001,VENTA DE MOTOCICLETAS,SI,COMERCIO AL POR MAYOR Y AL POR MENOR; REPARACIÓN DE VEHICULOS AUTOMOTORES Y MOTOCICLETAS
454002,"VENTA DE PARTES, PIEZAS Y ACCESORIOS DE MOTOCICLETAS",SI,COMERCIO AL POR MAYOR Y AL POR MENOR; REPARACIÓN DE VEHICULOS AUTOMOTORES Y MOTOCICLETAS
454003,MANTENIMIENTO Y REPARACIÓN DE MOTOCICLETAS,SI,COMERCIO AL POR MAYOR Y AL POR MENOR; REPARACIÓN DE VEHICULOS AUTOMOTORES Y MOTOCICLETAS
461001,CORRETAJE AL POR MAYOR DE PRODUCTOS AGRÍCOLAS,SI,COMERCIO AL POR MAYOR Y AL POR MENOR; REPARACIÓN DE VEHICULOS AUTOMOTORES Y MOTOCICLETAS
461002,CORRETAJE AL POR MAYOR DE GANADO,SI,COMERCIO AL POR MAYOR Y AL POR MENOR; REPARACIÓN DE VEHICULOS AUTOMOTORES Y MOTOCICLETAS
461009,OTROS TIPOS DE CORRETAJES O REMATES AL POR MAYOR N.C.P.,SI,COMERCIO AL POR MAYOR Y AL POR MENOR; REPARACIÓN DE VEHICULOS AUTOMOTORES Y MOTOCICLETAS
462010,VENTA AL POR MAYOR DE MATERIAS PRIMAS AGRÍCOLAS,SI,COMERCIO AL POR MAYOR Y AL POR MENOR; REPARACIÓN DE VEHICULOS AUTOMOTORES Y MOTOCICLETAS
462020,VENTA AL POR MAYOR DE ANIMALES VIVOS,SI,COMERCIO AL POR MAYOR Y AL POR MENOR; REPARACIÓN DE VEHICULOS AUTOMOTORES Y MOTOCICLETAS
462090,VENTA AL POR MAYOR DE OTRAS MATERIAS PRIMAS AGROPECUARIAS N.C.P.,SI,COMERCIO AL POR MAYOR Y AL POR MENOR; REPARACIÓN DE VEHICULOS AUTOMOTORES Y MOTOCICLETAS
463011,VENTA AL POR MAYOR DE FRUTAS Y VERDURAS,SI,COMERCIO AL POR MAYOR Y AL POR MENOR; REPARACIÓN DE VEHICULOS AUTOMOTORES Y MOTOCICLETAS
463012,VENTA AL POR MAYOR DE CARNE Y PRODUCTOS CÁRNICOS,SI,COMERCIO AL POR MAYOR Y AL POR MENOR; REPARACIÓN DE VEHICULOS AUTOMOTORES Y MOTOCICLETAS
463013,"VENTA AL POR MAYOR DE PRODUCTOS DEL MAR (PESCADOS, MARISCOS Y ALGAS)",SI,COMERCIO AL POR MAYOR Y AL POR MENOR; REPARACIÓN DE VEHICULOS AUTOMOTORES Y MOTOCICLETAS
463014,VENTA AL POR MAYOR DE PRODUCTOS DE CONFITERÍA,SI,COMERCIO AL POR MAYOR Y AL POR MENOR; REPARACIÓN DE VEHICULOS AUTOMOTORES Y MOTOCICLETAS
463019,"VENTA AL POR MAYOR DE HUEVOS, LÁCTEOS, ABARROTES Y DE OTROS ALIMENTOS N.C.P.",SI,COMERCIO AL POR MAYOR Y AL POR MENOR; REPARACIÓN DE VEHICULOS AUTOMOTORES Y MOTOCICLETAS
463020,VENTA AL POR MAYOR DE BEBIDAS ALCOHÓLICAS Y NO ALCOHÓLICAS,NO,COMERCIO AL POR MAYOR Y AL POR MENOR; REPARACIÓN DE VEHICULOS AUTOMOTORES Y MOTOCICLETAS
463030,VENTA AL POR MAYOR DE TABACO,SI,COMERCIO AL POR MAYOR Y AL POR MENOR; REPARACIÓN DE VEHICULOS AUTOMOTORES Y MOTOCICLETAS
464100,"VENTA AL POR MAYOR DE PRODUCTOS TEXTILES, PRENDAS DE VESTIR Y CALZADO",SI,COMERCIO AL POR MAYOR Y AL POR MENOR; REPARACIÓN DE VEHICULOS AUTOMOTORES Y MOTOCICLETAS
464901,"VENTA AL POR MAYOR DE MUEBLES, EXCEPTO MUEBLES DE OFICINA",SI,COMERCIO AL POR MAYOR Y AL POR MENOR; REPARACIÓN DE VEHICULOS AUTOMOTORES Y MOTOCICLETAS
464902,VENTA AL POR MAYOR DE ARTÍCULOS ELÉCTRICOS Y ELECTRÓNICOS PARA EL HOGAR,SI,COMERCIO AL POR MAYOR Y AL POR MENOR; REPARACIÓN DE VEHICULOS AUTOMOTORES Y MOTOCICLETAS
464903,"VENTA AL POR MAYOR DE ARTÍCULOS DE PERFUMERÍA, DE TOCADOR Y COSMÉTICOS",SI,COMERCIO AL POR MAYOR Y AL POR MENOR; REPARACIÓN DE VEHICULOS AUTOMOTORES Y MOTOCICLETAS
464904,VENTA AL POR MAYOR DE ARTÍCULOS DE PAPELERÍA Y ESCRITORIO,SI,COMERCIO AL POR MAYOR Y AL POR MENOR; REPARACIÓN DE VEHICULOS AUTOMOTORES Y MOTOCICLETAS
464905,VENTA AL POR MAYOR DE LIBROS,SI,COMERCIO AL POR MAYOR Y AL POR MENOR; REPARACIÓN DE VEHICULOS AUTOMOTORES Y MOTOCICLETAS
464906,VENTA AL POR MAYOR DE DIARIOS Y REVISTAS,SI,COMERCIO AL POR MAYOR Y AL POR MENOR; REPARACIÓN DE VEHICULOS AUTOMOTORES Y MOTOCICLETAS
464907,VENTA AL POR MAYOR DE PRODUCTOS FARMACÉUTICOS Y MEDICINALES,SI,COMERCIO AL POR MAYOR Y AL POR MENOR; REPARACIÓN DE VEHICULOS AUTOMOTORES Y MOTOCICLETAS
464908,VENTA AL POR MAYOR DE INSTRUMENTOS CIENTÍFICOS Y QUIRÚRGICOS,SI,COMERCIO AL POR MAYOR Y AL POR MENOR; REPARACIÓN DE VEHICULOS AUTOMOTORES Y MOTOCICLETAS
464909,VENTA AL POR MAYOR DE OTROS ENSERES DOMÉSTICOS N.C.P.,SI,COMERCIO AL POR MAYOR Y AL POR MENOR; REPARACIÓN DE VEHICULOS AUTOMOTORES Y MOTOCICLETAS
465100,"VENTA AL POR MAYOR DE COMPUTADORES, EQUIPO PERIFÉRICO Y PROGRAMAS INFORMÁTICOS",SI,COMERCIO AL POR MAYOR Y AL POR MENOR; REPARACIÓN DE VEHICULOS AUTOMOTORES Y MOTOCICLETAS
465200,"VENTA AL POR MAYOR DE EQUIPO, PARTES Y PIEZAS ELECTRÓNICOS Y DE TELECOMUNICACIONES",SI,COMERCIO AL POR MAYOR Y AL POR MENOR; REPARACIÓN DE VEHICULOS AUTOMOTORES Y MOTOCICLETAS
465300,"VENTA AL POR MAYOR DE MAQUINARIA, EQUIPO Y MATERIALES AGROPECUARIOS",SI,COMERCIO AL POR MAYOR Y AL POR MENOR; REPARACIÓN DE VEHICULOS AUTOMOTORES Y MOTOCICLETAS
465901,"VENTA AL POR MAYOR DE MAQUINARIA METALÚRGICA, PARA LA MINERÍA, EXTRACCIÓN DE PETRÓLEO Y CONSTRUCCIÓN",SI,COMERCIO AL POR MAYOR Y AL POR MENOR; REPARACIÓN DE VEHICULOS AUTOMOTORES Y MOTOCICLETAS
465902,"VENTA AL POR MAYOR DE MAQUINARIA PARA LA ELABORACIÓN DE ALIMENTOS, BEBIDAS Y TABACO",SI,COMERCIO AL POR MAYOR Y AL POR MENOR; REPARACIÓN DE VEHICULOS AUTOMOTORES Y MOTOCICLETAS
465903,"VENTA AL POR MAYOR DE MAQUINARIA PARA LA INDUSTRIA TEXTIL, DEL CUERO Y DEL CALZADO",SI,COMERCIO AL POR MAYOR Y AL POR MENOR; REPARACIÓN DE VEHICULOS AUTOMOTORES Y MOTOCICLETAS
465904,VENTA AL POR MAYOR DE MAQUINARIA Y EQUIPO DE OFICINA; VENTA AL POR MAYOR DE MUEBLES DE OFICINA,SI,COMERCIO AL POR MAYOR Y AL POR MENOR; REPARACIÓN DE VEHICULOS AUTOMOTORES Y MOTOCICLETAS
465905,"VENTA AL POR MAYOR DE EQUIPO DE TRANSPORTE(EXCEPTO VEHÍCULOS AUTOMOTORES, MOTOCICLETAS Y BICICLETAS)",SI,COMERCIO AL POR MAYOR Y AL POR MENOR; REPARACIÓN DE VEHICULOS AUTOMOTORES Y MOTOCICLETAS
465909,VENTA AL POR MAYOR DE OTROS TIPOS DE MAQUINARIA Y EQUIPO N.C.P.,SI,COMERCIO AL POR MAYOR Y AL POR MENOR; REPARACIÓN DE VEHICULOS AUTOMOTORES Y MOTOCICLETAS
466100,"VENTA AL POR MAYOR DE COMBUSTIBLES SÓLIDOS, LÍQUIDOS Y GASEOSOS Y PRODUCTOS CONEXOS",SI,COMERCIO AL POR MAYOR Y AL POR MENOR; REPARACIÓN DE VEHICULOS AUTOMOTORES Y MOTOCICLETAS
466200,VENTA AL POR MAYOR DE METALES Y MINERALES METALÍFEROS,SI,COMERCIO AL POR MAYOR Y AL POR MENOR; REPARACIÓN DE VEHICULOS AUTOMOTORES Y MOTOCICLETAS
466301,VENTA AL POR MAYOR DE MADERA EN BRUTO Y PRODUCTOS PRIMARIOS DE LA ELABORACIÓN DE MADERA,SI,COMERCIO AL POR MAYOR Y AL POR MENOR; REPARACIÓN DE VEHICULOS AUTOMOTORES Y MOTOCICLETAS
466302,"VENTA AL POR MAYOR DE MATERIALES DE CONSTRUCCIÓN, ARTÍCULOS DE FERRETERÍA, GASFITERÍA Y CALEFACCIÓN",SI,COMERCIO AL POR MAYOR Y AL POR MENOR; REPARACIÓN DE VEHICULOS AUTOMOTORES Y MOTOCICLETAS
466901,VENTA AL POR MAYOR DE PRODUCTOS QUÍMICOS,SI,COMERCIO AL POR MAYOR Y AL POR MENOR; REPARACIÓN DE VEHICULOS AUTOMOTORES Y MOTOCICLETAS
466902,VENTA AL POR MAYOR DE DESECHOS METÁLICOS (CHATARRA),SI,COMERCIO AL POR MAYOR Y AL POR MENOR; REPARACIÓN DE VEHICULOS AUTOMOTORES Y MOTOCICLETAS
466909,"VENTA AL POR MAYOR DE DESPERDICIOS, DESECHOS Y OTROS PRODUCTOS N.C.P.",SI,COMERCIO AL POR MAYOR Y AL POR MENOR; REPARACIÓN DE VEHICULOS AUTOMOTORES Y MOTOCICLETAS
469000,VENTA AL POR MAYOR NO ESPECIALIZADA,NO,COMERCIO AL POR MAYOR Y AL POR MENOR; REPARACIÓN DE VEHICULOS AUTOMOTORES Y MOTOCICLETAS
471100,"VENTA AL POR MENOR EN COMERCIOS DE ALIMENTOS, BEBIDAS O TABACO (SUPERMERCADOS E HIPERMERCADOS)",SI,COMERCIO AL POR MAYOR Y AL POR MENOR; REPARACIÓN DE VEHICULOS AUTOMOTORES Y MOTOCICLETAS
471910,VENTA AL POR MENOR EN COMERCIOS DE VESTUARIO Y PRODUCTOS PARA EL HOGAR (GRANDES TIENDAS),SI,COMERCIO AL POR MAYOR Y AL POR MENOR; REPARACIÓN DE VEHICULOS AUTOMOTORES Y MOTOCICLETAS
471990,OTRAS ACTIVIDADES DE VENTA AL POR MENOR EN COMERCIOS NO ESPECIALIZADOS N.C.P.,NO,COMERCIO AL POR MAYOR Y AL POR MENOR; REPARACIÓN DE VEHICULOS AUTOMOTORES Y MOTOCICLETAS
472101,VENTA AL POR MENOR DE ALIMENTOS EN COMERCIOS ESPECIALIZADOS (ALMACENES PEQUEÑOS Y MINIMARKET),SI,COMERCIO AL POR MAYOR Y AL POR MENOR; REPARACIÓN DE VEHICULOS AUTOMOTORES Y MOTOCICLETAS
472102,VENTA AL POR MENOR EN COMERCIOS ESPECIALIZADOS DE CARNE Y PRODUCTOS CÁRNICOS,SI,COMERCIO AL POR MAYOR Y AL POR MENOR; REPARACIÓN DE VEHICULOS AUTOMOTORES Y MOTOCICLETAS
472103,VENTA AL POR MENOR EN COMERCIOS ESPECIALIZADOS DE FRUTAS Y VERDURAS (VERDULERÍAS),SI,COMERCIO AL POR MAYOR Y AL POR MENOR; REPARACIÓN DE VEHICULOS AUTOMOTORES Y MOTOCICLETAS
472104,"VENTA AL POR MENOR EN COMERCIOS ESPECIALIZADOS DE PESCADO, MARISCOS Y PRODUCTOS CONEXOS",SI,COMERCIO AL POR MAYOR Y AL POR MENOR; REPARACIÓN DE VEHICULOS AUTOMOTORES Y MOTOCICLETAS
472105,VENTA AL POR MENOR EN COMERCIOS ESPECIALIZADOS DE PRODUCTOS DE PANADERÍA Y PASTELERÍA,SI,COMERCIO AL POR MAYOR Y AL POR MENOR; REPARACIÓN DE VEHICULOS AUTOMOTORES Y MOTOCICLETAS
472109,"VENTA AL POR MENOR EN COMERCIOS ESPECIALIZADOS DE HUEVOS, CONFITES Y PRODUCTOS ALIMENTICIOS N.C.P.",SI,COMERCIO AL POR MAYOR Y AL POR MENOR; REPARACIÓN DE VEHICULOS AUTOMOTORES Y MOTOCICLETAS
472200,VENTA AL POR MENOR DE BEBIDAS ALCOHÓLICAS Y NO ALCOHÓLICAS EN COMERCIOS ESPECIALIZADOS (BOTILLERÍAS),NO,COMERCIO AL POR MAYOR Y AL POR MENOR; REPARACIÓN DE VEHICULOS AUTOMOTORES Y MOTOCICLETAS
472300,VENTA AL POR MENOR DE TABACO Y PRODUCTOS DE TABACO EN COMERCIOS ESPECIALIZADOS,SI,COMERCIO AL POR MAYOR Y AL POR MENOR; REPARACIÓN DE VEHICULOS AUTOMOTORES Y MOTOCICLETAS
473000,VENTA AL POR MENOR DE COMBUSTIBLES PARA VEHÍCULOS AUTOMOTORES EN COMERCIOS ESPECIALIZADOS,SI,COMERCIO AL POR MAYOR Y AL POR MENOR; REPARACIÓN DE VEHICULOS AUTOMOTORES Y MOTOCICLETAS
474100,"VENTA AL POR MENOR DE COMPUTADORES, EQUIPO PERIFÉRICO, PROGRAMAS INFORMÁTICOS Y EQUIPO DE TELECOM.",SI,COMERCIO AL POR MAYOR Y AL POR MENOR; REPARACIÓN DE VEHICULOS AUTOMOTORES Y MOTOCICLETAS
474200,VENTA AL POR MENOR DE EQUIPO DE SONIDO Y DE VIDEO EN COMERCIOS ESPECIALIZADOS,SI,COMERCIO AL POR MAYOR Y AL POR MENOR; REPARACIÓN DE VEHICULOS AUTOMOTORES Y MOTOCICLETAS
475100,"VENTA AL POR MENOR DE TELAS, LANAS, HILOS Y SIMILARES EN COMERCIOS ESPECIALIZADOS",SI,COMERCIO AL POR MAYOR Y AL POR MENOR; REPARACIÓN DE VEHICULOS AUTOMOTORES Y MOTOCICLETAS
475201,VENTA AL POR MENOR DE ARTÍCULOS DE FERRETERÍA Y MATERIALES DE CONSTRUCCIÓN,SI,COMERCIO AL POR MAYOR Y AL POR MENOR; REPARACIÓN DE VEHICULOS AUTOMOTORES Y MOTOCICLETAS
475202,"VENTA AL POR MENOR DE PINTURAS, BARNICES Y LACAS EN COMERCIOS ESPECIALIZADOS",SI,COMERCIO AL POR MAYOR Y AL POR MENOR; REPARACIÓN DE VEHICULOS AUTOMOTORES Y MOTOCICLETAS
475203,VENTA AL POR MENOR DE PRODUCTOS DE VIDRIO EN COMERCIOS ESPECIALIZADOS,SI,COMERCIO AL POR MAYOR Y AL POR MENOR; REPARACIÓN DE VEHICULOS AUTOMOTORES Y MOTOCICLETAS
475300,"VENTA AL POR MENOR DE TAPICES, ALFOMBRAS Y CUBRIMIENTOS PARA PAREDES Y PISOS",SI,COMERCIO AL POR MAYOR Y AL POR MENOR; REPARACIÓN DE VEHICULOS AUTOMOTORES Y MOTOCICLETAS
475901,VENTA AL POR MENOR DE MUEBLES Y COLCHONES EN COMERCIOS ESPECIALIZADOS,SI,COMERCIO AL POR MAYOR Y AL POR MENOR; REPARACIÓN DE VEHICULOS AUTOMOTORES Y MOTOCICLETAS
475902,VENTA AL POR MENOR DE INSTRUMENTOS MUSICALES EN COMERCIOS ESPECIALIZADOS,SI,COMERCIO AL POR MAYOR Y AL POR MENOR; REPARACIÓN DE VEHICULOS AUTOMOTORES Y MOTOCICLETAS
475909,"VENTA AL POR MENOR DE APARATOS ELÉCTRICOS, TEXTILES PARA EL HOGAR Y OTROS ENSERES DOMÉSTICOS N.C.P.",SI,COMERCIO AL POR MAYOR Y AL POR MENOR; REPARACIÓN DE VEHICULOS AUTOMOTORES Y MOTOCICLETAS
476101,VENTA AL POR MENOR DE LIBROS EN COMERCIOS ESPECIALIZADOS,SI,COMERCIO AL POR MAYOR Y AL POR MENOR; REPARACIÓN DE VEHICULOS AUTOMOTORES Y MOTOCICLETAS
476102,VENTA AL POR MENOR DE DIARIOS Y REVISTAS EN COMERCIOS ESPECIALIZADOS,SI,COMERCIO AL POR MAYOR Y AL POR MENOR; REPARACIÓN DE VEHICULOS AUTOMOTORES Y MOTOCICLETAS
476103,VENTA AL POR MENOR DE ARTÍCULOS DE PAPELERÍA Y ESCRITORIO EN COMERCIOS ESPECIALIZADOS,SI,COMERCIO AL POR MAYOR Y AL POR MENOR; REPARACIÓN DE VEHICULOS AUTOMOTORES Y MOTOCICLETAS
476200,VENTA AL POR MENOR DE GRABACIONES DE MÚSICA Y DE VIDEO EN COMERCIOS ESPECIALIZADOS,SI,COMERCIO AL POR MAYOR Y AL POR MENOR; REPARACIÓN DE VEHICULOS AUTOMOTORES Y MOTOCICLETAS
476301,VENTA AL POR MENOR DE ARTÍCULOS DE CAZA Y PESCA EN COMERCIOS ESPECIALIZADOS,SI,COMERCIO AL POR MAYOR Y AL POR MENOR; REPARACIÓN DE VEHICULOS AUTOMOTORES Y MOTOCICLETAS
476302,VENTA AL POR MENOR DE BICICLETAS Y SUS REPUESTOS EN COMERCIOS ESPECIALIZADOS,SI,COMERCIO AL POR MAYOR Y AL POR MENOR; REPARACIÓN DE VEHICULOS AUTOMOTORES Y MOTOCICLETAS
476309,VENTA AL POR MENOR DE OTROS ARTÍCULOS Y EQUIPOS DE DEPORTE N.C.P.,SI,COMERCIO AL POR MAYOR Y AL POR MENOR; REPARACIÓN DE VEHICULOS AUTOMOTORES Y MOTOCICLETAS
476400,VENTA AL POR MENOR DE JUEGOS Y JUGUETES EN COMERCIOS ESPECIALIZADOS,SI,COMERCIO AL POR MAYOR Y AL POR MENOR; REPARACIÓN DE VEHICULOS AUTOMOTORES Y MOTOCICLETAS
477101,VENTA AL POR MENOR DE CALZADO EN COMERCIOS ESPECIALIZADOS,SI,COMERCIO AL POR MAYOR Y AL POR MENOR; REPARACIÓN DE VEHICULOS AUTOMOTORES Y MOTOCICLETAS
477102,VENTA AL POR MENOR DE PRENDAS Y ACCESORIOS DE VESTIR EN COMERCIOS ESPECIALIZADOS,SI,COMERCIO AL POR MAYOR Y AL POR MENOR; REPARACIÓN DE VEHICULOS AUTOMOTORES Y MOTOCICLETAS
477103,"VENTA AL POR MENOR DE CARTERAS, MALETAS Y OTROS ACCESORIOS DE VIAJE EN COMERCIOS ESPECIALIZADOS",SI,COMERCIO AL POR MAYOR Y AL POR MENOR; REPARACIÓN DE VEHICULOS AUTOMOTORES Y MOTOCICLETAS
477201,VENTA AL POR MENOR DE PRODUCTOS FARMACÉUTICOS Y MEDICINALES EN COMERCIOS ESPECIALIZADOS,SI,COMERCIO AL POR MAYOR Y AL POR MENOR; REPARACIÓN DE VEHICULOS AUTOMOTORES Y MOTOCICLETAS
477202,VENTA AL POR MENOR DE ARTÍCULOS ORTOPÉDICOS EN COMERCIOS ESPECIALIZADOS,SI,COMERCIO AL POR MAYOR Y AL POR MENOR; REPARACIÓN DE VEHICULOS AUTOMOTORES Y MOTOCICLETAS
477203,"VENTA AL POR MENOR DE ARTÍCULOS DE PERFUMERÍA, DE TOCADOR Y COSMÉTICOS EN COMERCIOS ESPECIALIZADOS",SI,COMERCIO AL POR MAYOR Y AL POR MENOR; REPARACIÓN DE VEHICULOS AUTOMOTORES Y MOTOCICLETAS
477310,VENTA AL POR MENOR DE GAS LICUADO EN BOMBONAS (CILINDROS) EN COMERCIOS ESPECIALIZADOS,SI,COMERCIO AL POR MAYOR Y AL POR MENOR; REPARACIÓN DE VEHICULOS AUTOMOTORES Y MOTOCICLETAS
477391,VENTA AL POR MENOR DE ALIMENTO Y ACCESORIOS PARA MASCOTAS EN COMERCIOS ESPECIALIZADOS,SI,COMERCIO AL POR MAYOR Y AL POR MENOR; REPARACIÓN DE VEHICULOS AUTOMOTORES Y MOTOCICLETAS
477392,VENTA AL POR MENOR DE ARMAS Y MUNICIONES EN COMERCIOS ESPECIALIZADOS,SI,COMERCIO AL POR MAYOR Y AL POR MENOR; REPARACIÓN DE VEHICULOS AUTOMOTORES Y MOTOCICLETAS
477393,VENTA AL POR MENOR DE ARTÍCULOS ÓPTICOS EN COMERCIOS ESPECIALIZADOS,SI,COMERCIO AL POR MAYOR Y AL POR MENOR; REPARACIÓN DE VEHICULOS AUTOMOTORES Y MOTOCICLETAS
477394,"VENTA AL POR MENOR DE ARTÍCULOS DE JOYERÍA, BISUTERÍA Y RELOJERÍA EN COMERCIOS ESPECIALIZADOS",SI,COMERCIO AL POR MAYOR Y AL POR MENOR; REPARACIÓN DE VEHICULOS AUTOMOTORES Y MOTOCICLETAS
477395,"VENTA AL POR MENOR DE CARBÓN, LEÑA Y OTROS COMBUSTIBLES DE USO DOMÉSTICO EN COMERCIOS ESPECIALIZADOS",SI,COMERCIO AL POR MAYOR Y AL POR MENOR; REPARACIÓN DE VEHICULOS AUTOMOTORES Y MOTOCICLETAS
477396,"VENTA AL POR MENOR DE RECUERDOS, ARTESANÍAS Y ARTÍCULOS RELIGIOSOS EN COMERCIOS ESPECIALIZADOS",SI,COMERCIO AL POR MAYOR Y AL POR MENOR; REPARACIÓN DE VEHICULOS AUTOMOTORES Y MOTOCICLETAS
477397,"VENTA AL POR MENOR DE FLORES, PLANTAS, ARBOLES, SEMILLAS Y ABONOS EN COMERCIOS ESPECIALIZADOS",SI,COMERCIO AL POR MAYOR Y AL POR MENOR; REPARACIÓN DE VEHICULOS AUTOMOTORES Y MOTOCICLETAS
477398,VENTA AL POR MENOR DE MASCOTAS EN COMERCIOS ESPECIALIZADOS,SI,COMERCIO AL POR MAYOR Y AL POR MENOR; REPARACIÓN DE VEHICULOS AUTOMOTORES Y MOTOCICLETAS
477399,VENTA AL POR MENOR DE OTROS PRODUCTOS EN COMERCIOS ESPECIALIZADOS N.C.P.,SI,COMERCIO AL POR MAYOR Y AL POR MENOR; REPARACIÓN DE VEHICULOS AUTOMOTORES Y MOTOCICLETAS
477401,VENTA AL POR MENOR DE ANTIGÜEDADES EN COMERCIOS,SI,COMERCIO AL POR MAYOR Y AL POR MENOR; REPARACIÓN DE VEHICULOS AUTOMOTORES Y MOTOCICLETAS
477402,VENTA AL POR MENOR DE ROPA USADA EN COMERCIOS,SI,COMERCIO AL POR MAYOR Y AL POR MENOR; REPARACIÓN DE VEHICULOS AUTOMOTORES Y MOTOCICLETAS
477409,VENTA AL POR MENOR DE OTROS ARTÍCULOS DE SEGUNDA MANO EN COMERCIOS N.C.P.,SI,COMERCIO AL POR MAYOR Y AL POR MENOR; REPARACIÓN DE VEHICULOS AUTOMOTORES Y MOTOCICLETAS
478100,"VENTA AL POR MENOR DE ALIMENTOS, BEBIDAS Y TABACO EN PUESTOS DE VENTA Y MERCADOS (INCLUYE FERIAS)",SI,COMERCIO AL POR MAYOR Y AL POR MENOR; REPARACIÓN DE VEHICULOS AUTOMOTORES Y MOTOCICLETAS
478200,"VENTA AL POR MENOR DE PRODUCTOS TEXTILES, PRENDAS DE VESTIR Y CALZADO EN PUESTOS DE VENTA Y MERCADOS",SI,COMERCIO AL POR MAYOR Y AL POR MENOR; REPARACIÓN DE VEHICULOS AUTOMOTORES Y MOTOCICLETAS
478900,VENTA AL POR MENOR DE OTROS PRODUCTOS EN PUESTOS DE VENTA Y MERCADOS (INCLUYE FERIAS),SI,COMERCIO AL POR MAYOR Y AL POR MENOR; REPARACIÓN DE VEHICULOS AUTOMOTORES Y MOTOCICLETAS
479100,"VENTA AL POR MENOR POR CORREO, POR INTERNET Y VÍA TELEFÓNICA",SI,COMERCIO AL POR MAYOR Y AL POR MENOR; REPARACIÓN DE VEHICULOS AUTOMOTORES Y MOTOCICLETAS
479901,VENTA AL POR MENOR REALIZADA POR INDEPENDIENTES EN LA LOCOMOCIÓN COLECTIVA (LEY 20.388),SI,COMERCIO AL POR MAYOR Y AL POR MENOR; REPARACIÓN DE VEHICULOS AUTOMOTORES Y MOTOCICLETAS
479902,VENTA AL POR MENOR MEDIANTE MAQUINAS EXPENDEDORAS,SI,COMERCIO AL POR MAYOR Y AL POR MENOR; REPARACIÓN DE VEHICULOS AUTOMOTORES Y MOTOCICLETAS
479903,VENTA AL POR MENOR POR COMISIONISTAS (NO DEPENDIENTES DE COMERCIOS),NO,COMERCIO AL POR MAYOR Y AL POR MENOR; REPARACIÓN DE VEHICULOS AUTOMOTORES Y MOTOCICLETAS
479909,"OTRAS ACTIVIDADES DE VENTA POR MENOR NO REALIZADAS EN COMERCIOS, PUESTOS DE VENTA O MERCADOS N.C.P.",NO,COMERCIO AL POR MAYOR Y AL POR MENOR; REPARACIÓN DE VEHICULOS AUTOMOTORES Y MOTOCICLETAS
491100,TRANSPORTE INTERURBANO DE PASAJEROS POR FERROCARRIL,NO,TRANSPORTE Y ALMACENAMIENTO
491200,TRANSPORTE DE CARGA POR FERROCARRIL,SI,TRANSPORTE Y ALMACENAMIENTO
492110,TRANSPORTE URBANO Y SUBURBANO DE PASAJEROS VÍA METRO Y METROTREN,NO,TRANSPORTE Y ALMACENAMIENTO
492120,TRANSPORTE URBANO Y SUBURBANO DE PASAJEROS VÍA LOCOMOCIÓN COLECTIVA,NO,TRANSPORTE Y ALMACENAMIENTO
492130,TRANSPORTE DE PASAJEROS VÍA TAXI COLECTIVO,NO,TRANSPORTE Y ALMACENAMIENTO
492190,OTRAS ACTIVIDADES DE TRANSPORTE URBANO Y SUBURBANO DE PASAJEROS POR VÍA TERRESTRE N.C.P.,NO,TRANSPORTE Y ALMACENAMIENTO
492210,SERVICIOS DE TRANSPORTE DE ESCOLARES,NO,TRANSPORTE Y ALMACENAMIENTO
492220,SERVICIOS DE TRANSPORTE DE TRABAJADORES,NO,TRANSPORTE Y ALMACENAMIENTO
492230,SERVICIOS DE TRANSPORTE DE PASAJEROS EN TAXIS LIBRES Y RADIOTAXIS,NO,TRANSPORTE Y ALMACENAMIENTO
492240,SERVICIOS DE TRANSPORTE A TURISTAS,NO,TRANSPORTE Y ALMACENAMIENTO
492250,TRANSPORTE DE PASAJEROS EN BUSES INTERURBANOS,NO,TRANSPORTE Y ALMACENAMIENTO
492290,OTRAS ACTIVIDADES DE TRANSPORTE DE PASAJEROS POR VÍA TERRESTRE N.C.P.,NO,TRANSPORTE Y ALMACENAMIENTO
492300,TRANSPORTE DE CARGA POR CARRETERA,SI,TRANSPORTE Y ALMACENAMIENTO
493010,TRANSPORTE POR OLEODUCTOS,SI,TRANSPORTE Y ALMACENAMIENTO
493020,TRANSPORTE POR GASODUCTOS,SI,TRANSPORTE Y ALMACENAMIENTO
493090,OTRAS ACTIVIDADES DE TRANSPORTE POR TUBERÍAS N.C.P.,SI,TRANSPORTE Y ALMACENAMIENTO
501100,TRANSPORTE DE PASAJEROS MARÍTIMO Y DE CABOTAJE,NO,TRANSPORTE Y ALMACENAMIENTO
501200,TRANSPORTE DE CARGA MARÍTIMO Y DE CABOTAJE,SI,TRANSPORTE Y ALMACENAMIENTO
502100,TRANSPORTE DE PASAJEROS POR VÍAS DE NAVEGACIÓN INTERIORES,NO,TRANSPORTE Y ALMACENAMIENTO
502200,TRANSPORTE DE CARGA POR VÍAS DE NAVEGACIÓN INTERIORES,SI,TRANSPORTE Y ALMACENAMIENTO
511000,TRANSPORTE DE PASAJEROS POR VÍA AÉREA,NO,TRANSPORTE Y ALMACENAMIENTO
512000,TRANSPORTE DE CARGA POR VÍA AÉREA,SI,TRANSPORTE Y ALMACENAMIENTO
521001,EXPLOTACIÓN DE FRIGORÍFICOS PARA ALMACENAMIENTO Y DEPÓSITO,SI,TRANSPORTE Y ALMACENAMIENTO
521009,OTROS SERVICIOS DE ALMACENAMIENTO Y DEPÓSITO N.C.P.,SI,TRANSPORTE Y ALMACENAMIENTO
522110,EXPLOTACIÓN DE TERMINALES TERRESTRES DE PASAJEROS,SI,TRANSPORTE Y ALMACENAMIENTO
522120,EXPLOTACIÓN DE ESTACIONAMIENTOS DE VEHÍCULOS AUTOMOTORES Y PARQUÍMETROS,SI,TRANSPORTE Y ALMACENAMIENTO
522130,SERVICIOS PRESTADOS POR CONCESIONARIOS DE CARRETERAS,SI,TRANSPORTE Y ALMACENAMIENTO
522190,ACTIVIDADES DE SERVICIOS VINCULADAS AL TRANSPORTE TERRESTRE N.C.P.,SI,TRANSPORTE Y ALMACENAMIENTO
522200,ACTIVIDADES DE SERVICIOS VINCULADAS AL TRANSPORTE ACUÁTICO,SI,TRANSPORTE Y ALMACENAMIENTO
522300,ACTIVIDADES DE SERVICIOS VINCULADAS AL TRANSPORTE AÉREO,SI,TRANSPORTE Y ALMACENAMIENTO
522400,MANIPULACIÓN DE LA CARGA,SI,TRANSPORTE Y ALMACENAMIENTO
522910,AGENCIAS DE ADUANAS,SI,TRANSPORTE Y ALMACENAMIENTO
522920,AGENCIAS DE NAVES,SI,TRANSPORTE Y ALMACENAMIENTO
522990,OTRAS ACTIVIDADES DE APOYO AL TRANSPORTE N.C.P.,SI,TRANSPORTE Y ALMACENAMIENTO
531000,ACTIVIDADES POSTALES,SI,TRANSPORTE Y ALMACENAMIENTO
532000,ACTIVIDADES DE MENSAJERÍA,SI,TRANSPORTE Y ALMACENAMIENTO
551001,ACTIVIDADES DE HOTELES,SI,ACTIVIDADES DE ALOJAMIENTO Y DE SERVICIO DE COMIDAS
551002,ACTIVIDADES DE MOTELES,SI,ACTIVIDADES DE ALOJAMIENTO Y DE SERVICIO DE COMIDAS
551003,ACTIVIDADES DE RESIDENCIALES PARA TURISTAS,SI,ACTIVIDADES DE ALOJAMIENTO Y DE SERVICIO DE COMIDAS
551009,OTRAS ACTIVIDADES DE ALOJAMIENTO PARA TURISTAS N.C.P.,SI,ACTIVIDADES DE ALOJAMIENTO Y DE SERVICIO DE COMIDAS
552000,ACTIVIDADES DE CAMPING Y DE PARQUES PARA CASAS RODANTES,SI,ACTIVIDADES DE ALOJAMIENTO Y DE SERVICIO DE COMIDAS
559001,ACTIVIDADES DE RESIDENCIALES PARA ESTUDIANTES Y TRABAJADORES,SI,ACTIVIDADES DE ALOJAMIENTO Y DE SERVICIO DE COMIDAS
559009,OTRAS ACTIVIDADES DE ALOJAMIENTO N.C.P.,SI,ACTIVIDADES DE ALOJAMIENTO Y DE SERVICIO DE COMIDAS
561000,ACTIVIDADES DE RESTAURANTES Y DE SERVICIO MÓVIL DE COMIDAS,SI,ACTIVIDADES DE ALOJAMIENTO Y DE SERVICIO DE COMIDAS
562100,SUMINISTRO DE COMIDAS POR ENCARGO (SERVICIOS DE BANQUETERÍA),SI,ACTIVIDADES DE ALOJAMIENTO Y DE SERVICIO DE COMIDAS
562900,SUMINISTRO INDUSTRIAL DE COMIDAS POR ENCARGO; CONCESIÓN DE SERVICIOS DE ALIMENTACIÓN,SI,ACTIVIDADES DE ALOJAMIENTO Y DE SERVICIO DE COMIDAS
563001,"ACTIVIDADES DE DISCOTECAS Y CABARET (NIGHT CLUB), CON PREDOMINIO DEL SERVICIO DE BEBIDAS",SI,ACTIVIDADES DE ALOJAMIENTO Y DE SERVICIO DE COMIDAS
563009,OTRAS ACTIVIDADES DE SERVICIO DE BEBIDAS N.C.P.,SI,ACTIVIDADES DE ALOJAMIENTO Y DE SERVICIO DE COMIDAS
